{"adapter_binding":{"adapter_id":"test-adapter","adapter_profile":"test-profile","adapter_version":"1.0.0","capabilities_digest":"56bf92ae18104d4616634a43810c3873e2a73c8c8063d3970fa12229d5542997","plugin_fingerprint":"bb2b5d56f0c113ac2fd57cf5ee7a7fbc39820dc24d4a04d25d5020017999b06c","plugin_id":"test-plugin","plugin_version":"1.0.0","protocol_major":1,"protocol_minor":0},"audit_id":"native-audit-c752652ee8c277c3c8299d11faf053a0","created_at":"2026-08-05T17:44:16Z","document_binding":{"block_state_digest":"2a12da17d27cd05ab0f3148816c1b4a702334202e82c5ad0dff734cb45db8017","complete_geometry_digest":"5c89f4e80fdf63c0810345f55a84ae411824bedaa68a8ba875d1843b87ebc954","container_order_digest":"981a40fe0d27b4d69b1568f9d7258a4123431b1358e4564e291706848fd3821f","database_instance_fingerprint":"3549b0028b75d981cdda2e573e9cb49dedc200185876df299f912b79f69dabd8","document_state_digest":"f8685cd124959aff65c7373ab755ed2d81f413db5c2f21a273e2c39041edbfe0","layout_state_digest":"7c31f497d1da5b02bb278e75f812c2e45c60a17f705223fd21e7d90b8dcd210b","ordered_entity_digest":"7cf72708d338d3c128b02ed1f1ffc9667c391bea7c471e65302a27849204e16c","protected_order_digest":"ded00edd010fadb8309b9f7060d31e4257285a687e7520b712e2804c4d7d3396","protected_state_digest":"994c3b38565d498b2a888a675e355430ef7b37966cb1420417e0329dcd3f7eb2","revision_fingerprint":"2b214ddf3326016519afcb268f63623b80b91a65265277668e4d020d87dd9078","table_state_digest":"d98a034f5cb8a0e3f07d5d8b5dc3c43723ea8d8b95199e18a82c52e072eca4dd"},"expires_at":"2026-08-05T17:59:16Z","findings":[{"actionability":true,"finding_id":"native-finding-66e961883099a80065ad4113","profile":"translate_dbtext/v1","status":"actionable","target_id":"native-target-635e3457576b2b313786bb9e"},{"actionability":true,"finding_id":"native-finding-c64e9484f20c6bfb0bccbb86","profile":"delete_auxiliary_overlay_text/v1","status":"actionable","target_id":"native-target-635e3457576b2b313786bb9e"}],"geometry_document_binding_digest":"52252b59e3a8194c8f8207870b45f0cdf23f51b8d40fe3bab7266e01f46df5b4","host_executable_fingerprint":"0d3917d207eee802aa7ba4e352eb8b3990d36cc19cd8753bff2685d8e5595c10","integrity":{"algorithm":"SHA-256","sha256":"328368360f2536762a0679e862996b0ae4dc3aa850ae1366fd5f89c68551f3f4"},"marker_policy_binding":{"enabled":false,"geometry_defaults":{"block_path":[],"overlay_evidence":{"corresponding_right_absent":false,"left_panel":false,"unique_content":false,"unsupported_data":true,"visible_interference":false},"space_kind":"modelspace"},"height_bits":"4004000000000000","layer":"REVIEW","layer_fingerprint":"b3b6039febc1ab8ac04076e32b7b2af0444a6e76164baba744a23e1e4545786a","plugin_capability":false,"policy_version":"marker-policy/v1","profile":"create_review_marker/v1","profile_enabled":false,"rotation_bits":"0000000000000000","style":"STANDARD","style_fingerprint":"edc92dc8b0b3f48a6893d4295c809499417bf4a4bccbef8aebd37877d1c4891c","text_derivation_version":"operation-id-suffix/v1","text_prefix":"LPF-REVIEW-"},"marker_prerequisites":{"layer_fingerprint":"b3b6039febc1ab8ac04076e32b7b2af0444a6e76164baba744a23e1e4545786a","style_fingerprint":"edc92dc8b0b3f48a6893d4295c809499417bf4a4bccbef8aebd37877d1c4891c"},"native_host_binding":"ba56e2f4f7299efeba6708432c5ce78b524a2a28b0b35a32b8efc3a451cdcb3c","protected_state_digest":"994c3b38565d498b2a888a675e355430ef7b37966cb1420417e0329dcd3f7eb2","record_cardinality":"explicit_private","records":[{"before_geometry_fingerprint":"e72eecc33fec4651452cfd9759678294a88b7e8633053fa4d2dc8b369390225d","eligible_profiles":["translate_dbtext/v1","delete_auxiliary_overlay_text/v1"],"native_type":"DBTEXT","opaque_state_digest":"38f879799a159064f75aed587d5b7b9a2b070918d5378922c4c6b4d4266eaa94","target_id":"native-target-635e3457576b2b313786bb9e"}],"schema_version":"liang-pingfa/native-audit/v1","scope":"native-representation-and-readability-only","session_binding_digest":"c8c70566a1b3b5aa69e6e608896b4c448b7a95dd300cd65c86771cc59d003308","source":{"byte_size":128,"dwg_header_signature":"AC1032","file_identity_fingerprint":"689f6a627384c7dcb2dcc1487e540223e77bdf9dcd0d8be8a326eda65b0ce9a4","format":"DWG","path_fingerprint":"a0af9f865bf637e6736817f4ce552e4cdf7b8c36ea75bc254c1d1f0af744b5bf","sha256":"41cf6794ba4200b839c53531555f0f3998df4cbb01a4d5cb0b94e3ca5e23947d"}}
